<xs:schema
   xmlns:xs="http://www.w3.org/2001/XMLSchema"
   xmlns:po="http://inetsolv.info/po"
   targetNamespace="http://inetsolv.info/po"
   elementFormDefault="qualified">

  <xs:element name="purchase-order">
    	<xs:complexType>
      	<xs:sequence>
			<xs:element name="customer">
 	 		<xs:complexType>
   	 			<xs:sequence>
     	 				<xs:element name="name" type="xs:string"/>
      				<xs:element name="address" type="xs:string"/>
	    			</xs:sequence>
    					<xs:attribute name="age" type="xs:int"/>
					<xs:attribute name="sa" type="xs:int" fixed="200"/>
	      	</xs:complexType>
			</xs:element>
			<xs:element name="line-item" minOccurs="1" maxOccurs="unbounded">
	 		<xs:complexType>
    				<xs:sequence>
      				<xs:element name="description" type="xs:string"/>
		      		<xs:element name="price" type="xs:decimal"/>
		      		<xs:element name="quantity" type="xs:integer"/>
				</xs:sequence>
			</xs:complexType>
			</xs:element>
      	</xs:sequence>
	</xs:complexType>
</xs:element>
</xs:schema>